{
  "$schema": "https://json-schema.org/draft/2020-12/schema",
  "$id": "ecosystem/contracts/distribution-profile/1",
  "title": "Distribution Profile — schemaVersion 1",
  "description": "Descreve quais componentes formam uma edição/distribuição e em que condições (ADD-0002 §7-§8, distribution.md; ADR-0012). Arquitetura ≠ distribuição. Três eixos independentes por entrada (visibility, distribution, commercialModel), mais availability; NOMES E VALORES CONGELADOS em P2-9 (2026-10-01, depois de DEC-0020-B e DEC-0021-C): mudar um nome exige ADR e migração dos perfis. SOURCE ≠ DISTRIBUTION: a fonte de desenvolvimento de um componente é o seu `path` em ecosystem.json (apps/<id> no Ecosystem); `channels` descrevem POR ONDE builds/releases/web chegam ao usuário e nunca copiam URLs: apontam para o campo do componente (`locationFrom`). `status`: `example` (ilustrativo), `current` (o arranjo REAL vigente; só descreve canais que existem) ou `target` (direção decidida pelo proprietário, ainda NÃO operacional; precisa citar a decisão). NN-023: nenhum perfil que inclua um Product público pode ter o Hub como 'bundled'.",
  "type": "object",
  "additionalProperties": false,
  "required": [
    "$schema",
    "schemaVersion",
    "id",
    "name",
    "entries"
  ],
  "properties": {
    "$schema": {
      "type": "string"
    },
    "schemaVersion": {
      "const": 1
    },
    "id": {
      "type": "string",
      "pattern": "^[a-z][a-z0-9]*(-[a-z0-9]+)*$"
    },
    "name": {
      "type": "string",
      "minLength": 1
    },
    "description": {
      "type": "string",
      "minLength": 1
    },
    "entries": {
      "type": "array",
      "minItems": 1,
      "items": {
        "type": "object",
        "additionalProperties": false,
        "required": [
          "component",
          "availability",
          "visibility",
          "distribution",
          "commercialModel"
        ],
        "properties": {
          "component": {
            "type": "string",
            "pattern": "^[a-z][a-z0-9]*(-[a-z0-9]+)*$"
          },
          "availability": {
            "description": "Como o componente entra no perfil: bundled (vem junto), optional (instalável à parte), marketplace (via catálogo), unavailable (interno/fora do perfil).",
            "enum": [
              "bundled",
              "optional",
              "marketplace",
              "unavailable"
            ]
          },
          "visibility": {
            "enum": [
              "public",
              "unlisted",
              "private",
              "internal"
            ]
          },
          "distribution": {
            "description": "first-party = plataforma própria do Ecosystem (direção decidida em DEC-0021-C; ainda inexistente); external-store = loja de terceiros; external-channel = canal externo ao Ecosystem que publica os builds (hoje GitHub Releases/Pages dos repositórios de origem); none = não distribuído.",
            "enum": [
              "first-party",
              "external-store",
              "external-channel",
              "none"
            ]
          },
          "commercialModel": {
            "enum": [
              "free",
              "paid",
              "subscription",
              "undecided"
            ]
          },
          "channels": {
            "description": "Canais pelos quais builds/releases/web chegam ao usuário. Opcional em exemplos; obrigatório em perfis `current`.",
            "type": "array",
            "minItems": 1,
            "items": {
              "type": "object",
              "additionalProperties": false,
              "required": [
                "id",
                "kind",
                "role"
              ],
              "properties": {
                "id": {
                  "type": "string",
                  "pattern": "^[a-z][a-z0-9]*(-[a-z0-9]+)*$"
                },
                "kind": {
                  "description": "Tipo do canal. first-party-platform só pode aparecer em perfis `target` enquanto a plataforma não existir.",
                  "enum": [
                    "github-release",
                    "github-pages",
                    "first-party-platform",
                    "external-store"
                  ]
                },
                "role": {
                  "description": "primary = onde o usuário obtém o produto; mirror/legacy/alternative = papéis secundários (espelho, legado, canal alternativo/recuperação).",
                  "enum": [
                    "primary",
                    "mirror",
                    "legacy",
                    "alternative"
                  ]
                },
                "locationFrom": {
                  "description": "Campo do componente em ecosystem.json de onde vem a localização (sem copiar a URL; NN-001): source.repository = repositório de ORIGEM (nome histórico do campo: é o repositório que distribui e espelha, não onde se desenvolve) ou publicUrl. Obrigatório em canais existentes; ausente apenas no canal first-party-platform de um perfil target (a plataforma ainda não tem localização).",
                  "enum": [
                    "source.repository",
                    "publicUrl"
                  ]
                },
                "artifacts": {
                  "type": "array",
                  "items": {
                    "type": "string",
                    "pattern": "^[a-z][a-z0-9]*(-[a-z0-9]+)*$"
                  }
                },
                "updateMechanism": {
                  "description": "Como o app instalado/aberto recebe atualização por este canal.",
                  "enum": [
                    "none",
                    "github-latest-release",
                    "service-worker"
                  ]
                }
              }
            }
          }
        }
      }
    },
    "status": {
      "description": "example = ilustrativo; current = arranjo real vigente; target = direção decidida, não operacional.",
      "enum": [
        "example",
        "current",
        "target"
      ]
    },
    "decisions": {
      "description": "Decisões que sustentam este perfil (existem em decisions.json). Em `current`: as decisões transitórias vigentes.",
      "type": "array",
      "items": {
        "type": "string",
        "pattern": "^DEC-\\d{4}$"
      }
    }
  }
}
